Sheet: Worksheet1
A1: Function Name | B1: Threads | C1: Duration (μs) | D1: Device ID
A2: mtp_yloop | B2: 33554240 | C2: 10015651.095000001 | D2: 0 | F2: =RC[-3]/RC[-4] -> 0.2984913708371878 | G2: =AVERAGE(RC[-1]:R[28]C[-1]) -> 0.30454481443097547 | H2: =STDEV(RC[-2]:R[28]C[-2]) -> 1.4439093690343052E-3
A3: mtp_yloop | B3: 33554240 | C3: 10118380.414999999 | D3: 0 | F3: =RC[-3]/RC[-4] -> 0.30155296066905402
A4: mtp_yloop | B4: 33554240 | C4: 10157373.188999999 | D4: 0 | F4: =RC[-3]/RC[-4] -> 0.30271504254007836
A5: mtp_yloop | B5: 33554240 | C5: 10182163.556 | D5: 0 | F5: =RC[-3]/RC[-4] -> 0.30345385727705348
A6: mtp_yloop | B6: 33554240 | C6: 10198684.868000001 | D6: 0 | F6: =RC[-3]/RC[-4] -> 0.30394623356094491
A7: mtp_yloop | B7: 33554240 | C7: 10213194.037 | D7: 0 | F7: =RC[-3]/RC[-4] -> 0.30437864296732692
A8: mtp_yloop | B8: 33554240 | C8: 10216744.671 | D8: 0 | F8: =RC[-3]/RC[-4] -> 0.30448446071196966
A9: mtp_yloop | B9: 33554240 | C9: 10228633.098999999 | D9: 0 | F9: =RC[-3]/RC[-4] -> 0.30483876550325678
A10: mtp_yloop | B10: 33554240 | C10: 10226710.497 | D10: 0 | F10: =RC[-3]/RC[-4] -> 0.30478146717076587
A11: mtp_yloop | B11: 33554240 | C11: 10234160.321 | D11: 0 | F11: =RC[-3]/RC[-4] -> 0.30500349049777314
A12: mtp_yloop | B12: 33554240 | C12: 10230571.606000001 | D12: 0 | F12: =RC[-3]/RC[-4] -> 0.30489653784439763
A13: mtp_yloop | B13: 33554240 | C13: 10235977.222999999 | D13: 0 | F13: =RC[-3]/RC[-4] -> 0.3050576387067625
A14: mtp_yloop | B14: 33554240 | C14: 10237722.665999999 | D14: 0 | F14: =RC[-3]/RC[-4] -> 0.30510965725941042
A15: mtp_yloop | B15: 33554240 | C15: 10243639.216 | D15: 0 | F15: =RC[-3]/RC[-4] -> 0.30528598519888994
A16: mtp_yloop | B16: 33554240 | C16: 10242332.83 | D16: 0 | F16: =RC[-3]/RC[-4] -> 0.30524705163937554
A17: mtp_yloop | B17: 33554240 | C17: 10237885.073000001 | D17: 0 | F17: =RC[-3]/RC[-4] -> 0.30511449739287794
A18: mtp_yloop | B18: 33554240 | C18: 10244953.763 | D18: 0 | F18: =RC[-3]/RC[-4] -> 0.30532516197654902
A19: mtp_yloop | B19: 33554240 | C19: 10242735.213 | D19: 0 | F19: =RC[-3]/RC[-4] -> 0.30525904365588369
A20: mtp_yloop | B20: 33554240 | C20: 10241255.955 | D20: 0 | F20: =RC[-3]/RC[-4] -> 0.30521495807981347
A21: mtp_yloop | B21: 33554240 | C21: 10238150.234999999 | D21: 0 | F21: =RC[-3]/RC[-4] -> 0.30512239988150525
A22: mtp_yloop | B22: 33554240 | C22: 10238202.620999999 | D22: 0 | F22: =RC[-3]/RC[-4] -> 0.30512396111489931
A23: mtp_yloop | B23: 33554240 | C23: 10237176.756999999 | D23: 0 | F23: =RC[-3]/RC[-4] -> 0.30509338781030354
A24: mtp_yloop | B24: 33554240 | C24: 10238454.311000001 | D24: 0 | F24: =RC[-3]/RC[-4] -> 0.30513146210434211
A25: mtp_yloop | B25: 33554240 | C25: 10241364.184 | D25: 0 | F25: =RC[-3]/RC[-4] -> 0.30521818357381958
A26: mtp_yloop | B26: 33554240 | C26: 10241173.681 | D26: 0 | F26: =RC[-3]/RC[-4] -> 0.30521250610951106
A27: mtp_yloop | B27: 33554240 | C27: 10241036.363 | D27: 0 | F27: =RC[-3]/RC[-4] -> 0.30520841369078838
A28: mtp_yloop | B28: 33554240 | C28: 10238122.203 | D28: 0 | F28: =RC[-3]/RC[-4] -> 0.3051215644580238
A29: mtp_yloop | B29: 33554240 | C29: 10240494.710000001 | D29: 0 | F29: =RC[-3]/RC[-4] -> 0.30519227108109143
A30: mtp_yloop | B30: 33554240 | C30: 10241379.673 | D30: 0 | F30: =RC[-3]/RC[-4] -> 0.30521864518463243