Sheet: Worksheet1
A1: Function Name | B1: Threads | C1: Duration (μs) | D1: Device ID
A2: mtp_yloop | B2: 67108800 | C2: 20104397.605 | D2: 0 | F2: =RC[-3]/RC[-4] -> 0.29957915511825572 | G2: =AVERAGE(RC[-1]:R[21]C[-1]) -> 0.30493333186218091 | H2: =STDEV(RC[-2]:R[21]C[-2]) -> 1.3363697762639073E-3
A3: mtp_yloop | B3: 67108800 | C3: 20332944.335999999 | D3: 0 | F3: =RC[-3]/RC[-4] -> 0.30298477004506114
A4: mtp_yloop | B4: 67108800 | C4: 20415560.140999999 | D4: 0 | F4: =RC[-3]/RC[-4] -> 0.30421584264656792
A5: mtp_yloop | B5: 67108800 | C5: 20446357.620999999 | D5: 0 | F5: =RC[-3]/RC[-4] -> 0.3046747612980712
A6: mtp_yloop | B6: 67108800 | C6: 20474384.432999998 | D6: 0 | F6: =RC[-3]/RC[-4] -> 0.30509239373971814
A7: mtp_yloop | B7: 67108800 | C7: 20472741.585999999 | D7: 0 | F7: =RC[-3]/RC[-4] -> 0.30506791338840805
A8: mtp_yloop | B8: 67108800 | C8: 20480452.828000002 | D8: 0 | F8: =RC[-3]/RC[-4] -> 0.30518281995803831
A9: mtp_yloop | B9: 67108800 | C9: 20486749.519000001 | D9: 0 | F9: =RC[-3]/RC[-4] -> 0.30527664805509863
A10: mtp_yloop | B10: 67108800 | C10: 20483805.469000001 | D10: 0 | F10: =RC[-3]/RC[-4] -> 0.30523277824964834
A11: mtp_yloop | B11: 67108800 | C11: 20518355.734999999 | D11: 0 | F11: =RC[-3]/RC[-4] -> 0.30574761782359394
A12: mtp_yloop | B12: 67108800 | C12: 20503856.068999998 | D12: 0 | F12: =RC[-3]/RC[-4] -> 0.30553155575721808
A13: mtp_yloop | B13: 67108800 | C13: 20494316.660999998 | D13: 0 | F13: =RC[-3]/RC[-4] -> 0.30538940736535297
A14: mtp_yloop | B14: 67108800 | C14: 20501682.000999998 | D14: 0 | F14: =RC[-3]/RC[-4] -> 0.30549915958860835
A15: mtp_yloop | B15: 67108800 | C15: 20511431.818999998 | D15: 0 | F15: =RC[-3]/RC[-4] -> 0.30564444333679036
A16: mtp_yloop | B16: 67108800 | C16: 20494449.848999999 | D16: 0 | F16: =RC[-3]/RC[-4] -> 0.30539139202310278
A17: mtp_yloop | B17: 67108800 | C17: 20497215.173 | D17: 0 | F17: =RC[-3]/RC[-4] -> 0.30543259860107763
A18: mtp_yloop | B18: 67108800 | C18: 20495958.260000002 | D18: 0 | F18: =RC[-3]/RC[-4] -> 0.30541386911999618
A19: mtp_yloop | B19: 67108800 | C19: 20495498.146000002 | D19: 0 | F19: =RC[-3]/RC[-4] -> 0.30540701288057603
A20: mtp_yloop | B20: 67108800 | C20: 20510235.195999999 | D20: 0 | F20: =RC[-3]/RC[-4] -> 0.30562661224757409
A21: mtp_yloop | B21: 67108800 | C21: 20505301.149 | D21: 0 | F21: =RC[-3]/RC[-4] -> 0.30555308914777196
A22: mtp_yloop | B22: 67108800 | C22: 20477403.675000001 | D22: 0 | F22: =RC[-3]/RC[-4] -> 0.30513738399434948
A23: mtp_yloop | B23: 67108800 | C23: 20498522.317000002 | D23: 0 | F23: =RC[-3]/RC[-4] -> 0.30545207658310092