Sheet: Worksheet1
A1: Function Name | B1: Threads | C1: Duration (μs) | D1: Device ID
A2: mtp_yloop | B2: 536870720 | C2: 163295119.734 | D2: 0 | F2: =RC[-3]/RC[-4] -> 0.30416097144206339 | G2: =AVERAGE(RC[-1]:R[8]C[-1]) -> 0.30530301782501545 | H2: =STDEV(RC[-2]:R[8]C[-2]) -> 4.3136545363393533E-4
A3: mtp_yloop | B3: 536870720 | C3: 163980111.81 | D3: 0 | F3: =RC[-3]/RC[-4] -> 0.30543686906598294
A4: mtp_yloop | B4: 536870720 | C4: 163954191.072 | D4: 0 | F4: =RC[-3]/RC[-4] -> 0.30538858791181606
A5: mtp_yloop | B5: 536870720 | C5: 164015551.09200001 | D5: 0 | F5: =RC[-3]/RC[-4] -> 0.30550287989629982
A6: mtp_yloop | B6: 536870720 | C6: 163974799.78099999 | D6: 0 | F6: =RC[-3]/RC[-4] -> 0.30542697463739499
A7: mtp_yloop | B7: 536870720 | C7: 164027073.84099999 | D7: 0 | F7: =RC[-3]/RC[-4] -> 0.30552434269650613
A8: mtp_yloop | B8: 536870720 | C8: 164012406.037 | D8: 0 | F8: =RC[-3]/RC[-4] -> 0.30549702177276494
A9: mtp_yloop | B9: 536870720 | C9: 163950538.34299999 | D9: 0 | F9: =RC[-3]/RC[-4] -> 0.30538178417142958
A10: mtp_yloop | B10: 536870720 | C10: 163964467.271 | D10: 0 | F10: =RC[-3]/RC[-4] -> 0.3054077288308813